{
  "proposalId": "1b2c3d4e-1111-2222-3333-444455556666",
  "title": "Calibrate Epoch Pulse Parameters",
  "description": "Adjust pulse and challenge window for volatility regime shift.",
  "proposer": "validator-a",
  "submissionTimestamp": 1754784000000,
  "category": "governance",
  "body": {
    "context": "Observed coordinated slippage under current pulse.",
    "specification": "Set pulse=180s, challengeWindow=120s.",
    "affectedModules": [
      "epoch-coordinator",
      "governance-emitter"
    ],
    "compatibilityNotes": "Backward compatible."
  },
  "validatorSignatures": [],
  "voting": {
    "method": "weighted",
    "quorum": 0.6,
    "threshold": 0.66,
    "openTime": 1754784060,
    "closeTime": 1754784660,
    "votes": []
  },
  "status": "draft",
  "version": "0.1"
}